{
  "$schema": "https://json-schema.org/draft/2020-12/schema",
  "$id": "https://assent.dev/schemas/policy/v1alpha1/config.schema.json",
  "title": "Config",
  "description": "Repo wiring: environments, change classes, and fact providers (ADR-0010 config.yaml). Safety-bearing: unknown fields/enum values reject at every level (ADR-0017 §9).",
  "type": "object",
  "additionalProperties": false,
  "required": ["apiVersion", "kind", "environments", "classes"],
  "properties": {
    "apiVersion": { "const": "assent.dev/v1alpha1" },
    "kind": { "const": "Config" },
    "environments": {
      "type": "array",
      "minItems": 1,
      "items": { "$ref": "#/$defs/namedMatch" },
      "description": "Environment classifier; last match wins as the documented default (ADR-0010)."
    },
    "classes": {
      "type": "array",
      "minItems": 1,
      "items": { "$ref": "#/$defs/namedMatch" },
      "description": "Change-class classifier; MergePolicy packs are routed to classes via RulesetBinding."
    },
    "providers": {
      "type": "object",
      "additionalProperties": { "$ref": "#/$defs/provider" },
      "description": "Keyed by provider name (surfaced to rules as facts.<name>.*, ADR-0004)."
    }
  },
  "$defs": {
    "namedMatch": {
      "type": "object",
      "additionalProperties": false,
      "required": ["name", "match"],
      "properties": {
        "name": { "type": "string", "minLength": 1 },
        "match": { "$ref": "#/$defs/pathMatch" }
      }
    },
    "pathMatch": {
      "type": "object",
      "additionalProperties": false,
      "required": ["paths"],
      "properties": {
        "paths": {
          "type": "array",
          "minItems": 1,
          "items": { "type": "string", "minLength": 1 },
          "description": "Glob patterns against repo-relative file paths."
        }
      }
    },
    "provider": {
      "type": "object",
      "additionalProperties": false,
      "required": ["type"],
      "properties": {
        "type": {
          "type": "string",
          "minLength": 1,
          "description": "Provider implementation identifier (e.g. builtin/gitlab-groups, http, exec)."
        },
        "url": { "type": "string", "format": "uri" },
        "failure": {
          "enum": ["closed", "open"],
          "default": "closed",
          "description": "closed (default) demotes an unresolved fact to fail-safe (ADR-0004); a controlling/authorization provider may never be configured open (lint hard error, docs/planning/lint-hard-errors.md)."
        }
      }
    }
  }
}
